{
  "binary_version": "test",
  "created_at": "2025-01-01T00:00:00Z",
  "data_quality": {
    "exposure_completeness": {
      "missing": 1,
      "missing_rate": 0.3333333333333333,
      "total": 3
    },
    "join_integrity": {
      "assignment_join_rate": 0,
      "assignments_count": 0,
      "exposure_count": 3,
      "exposure_join_rate": 0.6666666666666666,
      "outcome_count": 2,
      "outcome_join_rate": 1
    },
    "outcome_completeness": {
      "missing": 0,
      "missing_rate": 0,
      "total": 2
    }
  },
  "effective_config": {
    "test": true
  },
  "git_commit": "deadbeef",
  "input_dataset_fingerprint": "fingerprint",
  "mode": "offline",
  "offline": {
    "baseline": {
      "baseline_run_id": "offline-20250101T000000Z",
      "deltas": [
        {
          "after": 0.16666666666666666,
          "before": 0.16666666666666666,
          "delta": 0,
          "name": "precision@2"
        },
        {
          "after": 0.3333333333333333,
          "before": 0.3333333333333333,
          "delta": 0,
          "name": "recall@2"
        }
      ]
    },
    "by_segment": {
      "surface=home|tenant=t1": [
        {
          "name": "precision@2",
          "value": 0.25
        },
        {
          "name": "recall@2",
          "value": 0.5
        }
      ],
      "surface=search|tenant=t1": [
        {
          "name": "precision@2",
          "value": 0
        },
        {
          "name": "recall@2",
          "value": 0
        }
      ]
    },
    "metrics": [
      {
        "name": "precision@2",
        "value": 0.16666666666666666
      },
      {
        "name": "recall@2",
        "value": 0.3333333333333333
      }
    ]
  },
  "run_id": "offline-20250101T000000Z",
  "summary": {
    "cases_evaluated": 3,
    "executive": {
      "decision": "not_configured",
      "highlights": [
        {
          "name": "precision@2",
          "value": 0.16666666666666666
        },
        {
          "name": "recall@2",
          "value": 0.3333333333333333
        }
      ],
      "key_deltas": [
        {
          "after": 0.16666666666666666,
          "before": 0.16666666666666666,
          "delta": 0,
          "name": "precision@2"
        },
        {
          "after": 0.3333333333333333,
          "before": 0.3333333333333333,
          "delta": 0,
          "name": "recall@2"
        }
      ],
      "next_steps": [
        "Increase sample size to stabilize metrics."
      ]
    }
  },
  "version": "0.1.0"
}
